<?xml version="1.0" encoding="UTF-8"?>
<CBAMDeclaration xmlns="https://ec.europa.eu/taxation_customs/cbam/v1"
                xmlns:xsi="http://www.w3.org/2001/XMLSchema-instance"
                xsi:schemaLocation="https://ec.europa.eu/taxation_customs/cbam/v1 cbam_declaration.xsd">
    
    <Header>
        <DeclarationID>DEC-2026-STEEL-001-Q1</DeclarationID>
        <ReportingPeriod>2026-Q1</ReportingPeriod>
        <Timestamp>2026-04-15T10:30:00Z</Timestamp>
    </Header>

    <Declarant>
        <EORINumber>DE123456789</EORINumber>
        <Name>SteelWorks GmbH</Name>
        <Address>Eisenstrasse 1, 40210 DÃ¼sseldorf, Germany</Address>
    </Declarant>

    <!-- Transformed from products.csv and emission_records.csv -->
    <Goods>
        <CNCode>72163211</CNCode> <!-- Industrial H-Beam -->
        <CountryOfOrigin>DE</CountryOfOrigin>
        <InstallationID>IOT-MT-STEEL-01</InstallationID>
        <NetMass>15000.00</NetMass>
        <EmbeddedEmissions>
            <DirectEmissions>450.00</DirectEmissions> <!-- SCOPE_1 -->
            <IndirectEmissions>1250.50</IndirectEmissions> <!-- SCOPE_2 -->
            <SpecificEmbeddedEmissions>0.113</SpecificEmbeddedEmissions>
        </EmbeddedEmissions>
    </Goods>

    <TotalEmissions>1700.50</TotalEmissions>
    <!-- Integrity proof generated by the JasperReports Engine -->
    <CertificationHash>sha256:7e8a9f0b1c2d3e4f5a6b7c8d9e0f1a2b3c4d5e6f7g8h9i0j1k2l3m4n5o6p</CertificationHash>
</CBAMDeclaration>